item_id,name,barcode,face_id,description,price,unit,category,brand,image_url
mea_027_5814,Small Shrimp,28645070352,face_027,"Fresh small shrimp, USDA inspected",20.9,lb,Meat,Fresh Market,https://via.placeholder.com/60x60/F8F9FA/333?text=游붏
mea_027_5055,Medium Shrimp,22257472194,face_027,"Fresh medium shrimp, USDA inspected",12.48,lb,Meat,Boar's Head,https://via.placeholder.com/60x60/F8F9FA/333?text=游붏
mea_027_8413,Red Snapper,27401367712,face_027,"Fresh red snapper, USDA inspected",23.71,lb,Meat,Hillshire Farm,https://via.placeholder.com/60x60/F8F9FA/333?text=游
mea_027_7528,Cod Fillets,26317369025,face_027,"Fresh cod fillets, USDA inspected",16.67,lb,Meat,Oscar Mayer,https://via.placeholder.com/60x60/F8F9FA/333?text=游
mea_027_1992,Mussels,20161525665,face_027,"Fresh mussels, USDA inspected",11.87,lb,Meat,Perdue,https://via.placeholder.com/60x60/F8F9FA/333?text=游
mea_027_3818,Tuna Steaks,28777552411,face_027,"Fresh tuna steaks, USDA inspected",23.15,lb,Meat,Oscar Mayer,https://via.placeholder.com/60x60/F8F9FA/333?text=游
mea_027_4229,Farmed Salmon,21543583962,face_027,"Fresh farmed salmon, USDA inspected",19.06,lb,Meat,Johnsonville,https://via.placeholder.com/60x60/F8F9FA/333?text=游
mea_027_2491,Sea Bass,23834675781,face_027,"Fresh sea bass, USDA inspected",14.51,lb,Meat,Fresh Market,https://via.placeholder.com/60x60/F8F9FA/333?text=游
mea_027_3499,Tilapia Fillets,20740443632,face_027,"Fresh tilapia fillets, USDA inspected",20.9,lb,Meat,Smithfield,https://via.placeholder.com/60x60/F8F9FA/333?text=游
mea_027_8553,Pacific Salmon,25596767610,face_027,"Fresh pacific salmon, USDA inspected",13.31,lb,Meat,Butterball,https://via.placeholder.com/60x60/F8F9FA/333?text=游
mea_027_3288,Mahi Mahi,20341362454,face_027,"Fresh mahi mahi, USDA inspected",10.79,lb,Meat,Johnsonville,https://via.placeholder.com/60x60/F8F9FA/333?text=游
mea_027_6421,Scallops,29631808104,face_027,"Fresh scallops, USDA inspected",18.08,lb,Meat,Oscar Mayer,https://via.placeholder.com/60x60/F8F9FA/333?text=游
mea_027_9223,Halibut,29981134492,face_027,"Fresh halibut, USDA inspected",9.03,lb,Meat,Smithfield,https://via.placeholder.com/60x60/F8F9FA/333?text=游
mea_027_5383,Swordfish,28852914765,face_027,"Fresh swordfish, USDA inspected",24.47,lb,Meat,Tyson,https://via.placeholder.com/60x60/F8F9FA/333?text=游
mea_027_3334,Haddock Fillets,29380610809,face_027,"Fresh haddock fillets, USDA inspected",13.57,lb,Meat,Smithfield,https://via.placeholder.com/60x60/F8F9FA/333?text=游
bak_028_9224,Whole Wheat Bread,12955784617,face_028,"Fresh baked whole wheat bread, made daily",2.95,each,Bakery,Wonder Bread,https://via.placeholder.com/60x60/F8F9FA/333?text=游
bak_028_9356,French Bread,08588484643,face_028,"Fresh baked french bread, made daily",4.79,each,Bakery,Thomas',https://via.placeholder.com/60x60/F8F9FA/333?text=游
bak_028_8562,Dinner Rolls,11496011732,face_028,"Fresh baked dinner rolls, made daily",3.79,each,Bakery,Bakery Fresh,https://via.placeholder.com/60x60/F8F9FA/333?text=游
bak_028_9656,Challah Bread,09131713117,face_028,"Fresh baked challah bread, made daily",3.59,each,Bakery,Bakery Fresh,https://via.placeholder.com/60x60/F8F9FA/333?text=游
bak_028_2435,Sourdough Bread,13845812411,face_028,"Fresh baked sourdough bread, made daily",3.43,each,Bakery,Thomas',https://via.placeholder.com/60x60/F8F9FA/333?text=游
bak_028_3045,Croissants,15862631863,face_028,"Fresh baked croissants, made daily",2.57,each,Bakery,Sara Lee,https://via.placeholder.com/60x60/F8F9FA/333?text=游
bak_028_6240,Pita Bread,12262616332,face_028,"Fresh baked pita bread, made daily",3.89,each,Bakery,Sara Lee,https://via.placeholder.com/60x60/F8F9FA/333?text=游
bak_028_7982,Bagels,14352338989,face_028,"Fresh baked bagels, made daily",2.1,each,Bakery,King's Hawaiian,https://via.placeholder.com/60x60/F8F9FA/333?text=游
bak_028_9347,Rye Bread,08200178810,face_028,"Fresh baked rye bread, made daily",2.44,each,Bakery,Bakery Fresh,https://via.placeholder.com/60x60/F8F9FA/333?text=游
bak_028_6455,Flatbread,10745396170,face_028,"Fresh baked flatbread, made daily",3.44,each,Bakery,La Brea,https://via.placeholder.com/60x60/F8F9FA/333?text=游
bak_028_4714,Tortillas,08207076107,face_028,"Fresh baked tortillas, made daily",3.62,each,Bakery,Bakery Select,https://via.placeholder.com/60x60/F8F9FA/333?text=游
bak_028_4741,Danish Pastries,16456146551,face_028,"Fresh baked danish pastries, made daily",2.89,each,Bakery,La Brea,https://via.placeholder.com/60x60/F8F9FA/333?text=游
bak_028_1103,White Bread,08986470668,face_028,"Fresh baked white bread, made daily",2.77,each,Bakery,King's Hawaiian,https://via.placeholder.com/60x60/F8F9FA/333?text=游
bak_028_9321,Naan Bread,11212261322,face_028,"Fresh baked naan bread, made daily",3.33,each,Bakery,Wonder Bread,https://via.placeholder.com/60x60/F8F9FA/333?text=游
bak_028_2858,English Muffins,07205619401,face_028,"Fresh baked english muffins, made daily",2.02,each,Bakery,Bakery Fresh,https://via.placeholder.com/60x60/F8F9FA/333?text=游븨
bak_028_6266,Brioche Bread,14249508947,face_028,"Fresh baked brioche bread, made daily",2.02,each,Bakery,La Brea,https://via.placeholder.com/60x60/F8F9FA/333?text=游
bak_028_1546,Hamburger Buns,07943478724,face_028,"Fresh baked hamburger buns, made daily",4.73,each,Bakery,Sara Lee,https://via.placeholder.com/60x60/F8F9FA/333?text=游
bak_028_2527,Italian Bread,10225920243,face_028,"Fresh baked italian bread, made daily",3.78,each,Bakery,King's Hawaiian,https://via.placeholder.com/60x60/F8F9FA/333?text=游
bak_028_4442,Pumpernickel Bread,08493203554,face_028,"Fresh baked pumpernickel bread, made daily",3.28,each,Bakery,La Brea,https://via.placeholder.com/60x60/F8F9FA/333?text=游
bak_028_5519,Hot Dog Buns,13277539131,face_028,"Fresh baked hot dog buns, made daily",3.37,each,Bakery,Bakery Fresh,https://via.placeholder.com/60x60/F8F9FA/333?text=游
bak_028_9011,Multigrain Bread,09478045840,face_028,"Fresh baked multigrain bread, made daily",2.65,each,Bakery,La Brea,https://via.placeholder.com/60x60/F8F9FA/333?text=游
pan_029_3000,Olive Oil,39446670257,face_029,"High quality olive oil, long shelf life",4.26,each,Pantry,Del Monte,https://via.placeholder.com/60x60/F8F9FA/333?text=游
pan_029_6696,Peanut Butter,35215278665,face_029,"High quality peanut butter, long shelf life",3.23,each,Pantry,Heinz,https://via.placeholder.com/60x60/F8F9FA/333?text=游븯
pan_029_2433,Mayonnaise,36101707754,face_029,"High quality mayonnaise, long shelf life",4.34,each,Pantry,Great Value,https://via.placeholder.com/60x60/F8F9FA/333?text=游
pan_029_8148,Vegetable Oil,32459978337,face_029,"High quality vegetable oil, long shelf life",3.57,each,Pantry,Campbell's,https://via.placeholder.com/60x60/F8F9FA/333?text=游
pan_029_9887,Vinegar,37431131219,face_029,"High quality vinegar, long shelf life",3.67,each,Pantry,Campbell's,https://via.placeholder.com/60x60/F8F9FA/333?text=游
pan_029_2634,Honey,31743095645,face_029,"High quality honey, long shelf life",4.63,each,Pantry,Heinz,https://via.placeholder.com/60x60/F8F9FA/333?text=游
pan_029_1527,Hot Sauce,38454966805,face_029,"High quality hot sauce, long shelf life",3.75,each,Pantry,Heinz,https://via.placeholder.com/60x60/F8F9FA/333?text=游
pan_029_6999,Soy Sauce,35873388868,face_029,"High quality soy sauce, long shelf life",3.91,each,Pantry,Hunt's,https://via.placeholder.com/60x60/F8F9FA/333?text=游
pan_029_2344,Jam,35419657031,face_029,"High quality jam, long shelf life",2.11,each,Pantry,Goya,https://via.placeholder.com/60x60/F8F9FA/333?text=游
pan_029_7351,Mustard,33113966792,face_029,"High quality mustard, long shelf life",2.3,each,Pantry,Del Monte,https://via.placeholder.com/60x60/F8F9FA/333?text=游
pan_029_5739,Worcestershire Sauce,33222653420,face_029,"High quality worcestershire sauce, long shelf life",2.11,each,Pantry,Bush's,https://via.placeholder.com/60x60/F8F9FA/333?text=游
pan_029_9827,Maple Syrup,37730349242,face_029,"High quality maple syrup, long shelf life",4.45,each,Pantry,Hunt's,https://via.placeholder.com/60x60/F8F9FA/333?text=游
pan_029_1513,Ketchup,30160107541,face_029,"High quality ketchup, long shelf life",3.36,each,Pantry,Campbell's,https://via.placeholder.com/60x60/F8F9FA/333?text=游
pan_029_9179,Jelly,34223850997,face_029,"High quality jelly, long shelf life",2.55,each,Pantry,Progresso,https://via.placeholder.com/60x60/F8F9FA/333?text=游
pro_030_4409,Dragon Fruit,8493,face_030,"Fresh dragon fruit, premium quality",4.01,lb,Produce,Local Farm,https://via.placeholder.com/60x60/F8F9FA/333?text=游
pro_030_5397,Cavendish Bananas,7865,face_030,"Fresh cavendish bananas, premium quality",4.28,lb,Produce,Driscoll's,https://via.placeholder.com/60x60/F8F9FA/333?text=游꼛
pro_030_5467,Clementines,6263,face_030,"Fresh clementines, premium quality",4.0,lb,Produce,Organic Valley,https://via.placeholder.com/60x60/F8F9FA/333?text=游
pro_030_8000,Mango,8399,face_030,"Fresh mango, premium quality",3.02,lb,Produce,Earthbound Farm,https://via.placeholder.com/60x60/F8F9FA/333?text=游
pro_030_2023,Papaya,8566,face_030,"Fresh papaya, premium quality",3.49,lb,Produce,Driscoll's,https://via.placeholder.com/60x60/F8F9FA/333?text=游
pro_030_5998,Plantains,4798,face_030,"Fresh plantains, premium quality",3.28,lb,Produce,Chiquita,https://via.placeholder.com/60x60/F8F9FA/333?text=游
pro_030_4292,Pineapple,9779,face_030,"Fresh pineapple, premium quality",0.65,lb,Produce,Del Monte,https://via.placeholder.com/60x60/F8F9FA/333?text=游꼝
pro_030_9098,Bananas,8453,face_030,"Fresh bananas, premium quality",1.08,lb,Produce,Del Monte,https://via.placeholder.com/60x60/F8F9FA/333?text=游꼛
pro_030_5938,Raspberries,9300,face_030,"Fresh raspberries, premium quality",1.46,lb,Produce,Fresh Harvest,https://via.placeholder.com/60x60/F8F9FA/333?text=游
pro_030_3789,Strawberries,7317,face_030,"Fresh strawberries, premium quality",4.36,lb,Produce,Local Farm,https://via.placeholder.com/60x60/F8F9FA/333?text=游
pro_030_6583,Blood Oranges,8360,face_030,"Fresh blood oranges, premium quality",1.14,lb,Produce,Driscoll's,https://via.placeholder.com/60x60/F8F9FA/333?text=游꼙
pro_030_4597,Fuji Apples,5427,face_030,"Fresh fuji apples, premium quality",1.39,lb,Produce,Earthbound Farm,https://via.placeholder.com/60x60/F8F9FA/333?text=游꼝
pro_030_3838,Kiwi,9111,face_030,"Fresh kiwi, premium quality",2.84,lb,Produce,Del Monte,https://via.placeholder.com/60x60/F8F9FA/333?text=游
pro_030_7452,Valencia Oranges,8566,face_030,"Fresh valencia oranges, premium quality",4.63,lb,Produce,Local Farm,https://via.placeholder.com/60x60/F8F9FA/333?text=游꼙
pro_030_6059,Gala Apples,7226,face_030,"Fresh gala apples, premium quality",0.78,lb,Produce,Earthbound Farm,https://via.placeholder.com/60x60/F8F9FA/333?text=游꼝
pro_030_7386,Blueberries,9354,face_030,"Fresh blueberries, premium quality",1.77,lb,Produce,Local Farm,https://via.placeholder.com/60x60/F8F9FA/333?text=游
pro_030_2819,Navel Oranges,4451,face_030,"Fresh navel oranges, premium quality",2.49,lb,Produce,Local Farm,https://via.placeholder.com/60x60/F8F9FA/333?text=游꼙
pro_030_1268,Red Grapes,5247,face_030,"Fresh red grapes, premium quality",2.23,lb,Produce,Fresh Harvest,https://via.placeholder.com/60x60/F8F9FA/333?text=游꼖
pro_030_6980,Black Grapes,5405,face_030,"Fresh black grapes, premium quality",3.88,lb,Produce,Organic Valley,https://via.placeholder.com/60x60/F8F9FA/333?text=游꼖
pro_030_7656,Green Grapes,6734,face_030,"Fresh green grapes, premium quality",0.6,lb,Produce,Dole,https://via.placeholder.com/60x60/F8F9FA/333?text=游꼖
pro_030_7278,Blackberries,7995,face_030,"Fresh blackberries, premium quality",4.26,lb,Produce,Dole,https://via.placeholder.com/60x60/F8F9FA/333?text=游
pro_030_7428,Organic Bananas,5774,face_030,"Fresh organic bananas, premium quality",1.59,lb,Produce,Earthbound Farm,https://via.placeholder.com/60x60/F8F9FA/333?text=游꼛
pro_030_6788,Cotton Candy Grapes,9218,face_030,"Fresh cotton candy grapes, premium quality",4.2,lb,Produce,Chiquita,https://via.placeholder.com/60x60/F8F9FA/333?text=游꼖
pro_030_8091,Granny Smith Apples,6325,face_030,"Fresh granny smith apples, premium quality",2.8,lb,Produce,Driscoll's,https://via.placeholder.com/60x60/F8F9FA/333?text=游꼝
pro_030_4440,Red Delicious Apples,7257,face_030,"Fresh red delicious apples, premium quality",2.94,lb,Produce,Earthbound Farm,https://via.placeholder.com/60x60/F8F9FA/333?text=游꼝
dai_031_9428,Light Cream,11687509309,face_031,"Premium light cream, great taste and quality",3.13,each,Dairy,Organic Valley,https://via.placeholder.com/60x60/F8F9FA/333?text=游
dai_031_2873,Half and Half,06166007939,face_031,"Premium half and half, great taste and quality",3.41,each,Dairy,Chobani,https://via.placeholder.com/60x60/F8F9FA/333?text=游
dai_031_7680,Free Range Eggs,09877219517,face_031,"Premium free range eggs, great taste and quality",2.78,each,Dairy,Fage,https://via.placeholder.com/60x60/F8F9FA/333?text=游볰
dai_031_1396,Large Eggs,02349543692,face_031,"Premium large eggs, great taste and quality",2.78,each,Dairy,Fage,https://via.placeholder.com/60x60/F8F9FA/333?text=游볰
dai_031_1428,Extra Large Eggs,03737488494,face_031,"Premium extra large eggs, great taste and quality",4.02,each,Dairy,Philadelphia,https://via.placeholder.com/60x60/F8F9FA/333?text=游볰
dai_031_9141,Condensed Milk,04124972524,face_031,"Premium condensed milk, great taste and quality",2.52,each,Dairy,Daisy,https://via.placeholder.com/60x60/F8F9FA/333?text=游볱
dai_031_6411,Evaporated Milk,09142953509,face_031,"Premium evaporated milk, great taste and quality",2.18,each,Dairy,Philadelphia,https://via.placeholder.com/60x60/F8F9FA/333?text=游볱
dai_031_5227,Jumbo Eggs,03182360378,face_031,"Premium jumbo eggs, great taste and quality",3.37,each,Dairy,Philadelphia,https://via.placeholder.com/60x60/F8F9FA/333?text=游볰
dai_031_2303,Liquid Eggs,06736436285,face_031,"Premium liquid eggs, great taste and quality",3.69,each,Dairy,Tillamook,https://via.placeholder.com/60x60/F8F9FA/333?text=游볰
dai_031_7917,Egg Whites,07861380309,face_031,"Premium egg whites, great taste and quality",4.63,each,Dairy,Chobani,https://via.placeholder.com/60x60/F8F9FA/333?text=游볰
dai_031_8888,Sour Cream,10291248399,face_031,"Premium sour cream, great taste and quality",4.86,each,Dairy,Great Value,https://via.placeholder.com/60x60/F8F9FA/333?text=游
dai_031_7857,Heavy Cream,04447647376,face_031,"Premium heavy cream, great taste and quality",3.28,each,Dairy,Daisy,https://via.placeholder.com/60x60/F8F9FA/333?text=游
dai_031_5665,Buttermilk,08967545907,face_031,"Premium buttermilk, great taste and quality",3.07,each,Dairy,Land O'Lakes,https://via.placeholder.com/60x60/F8F9FA/333?text=游볱
dai_031_7639,Cage Free Eggs,03352678513,face_031,"Premium cage free eggs, great taste and quality",2.96,each,Dairy,Daisy,https://via.placeholder.com/60x60/F8F9FA/333?text=游볰
dai_031_6671,Organic Eggs,01794815682,face_031,"Premium organic eggs, great taste and quality",4.16,each,Dairy,Philadelphia,https://via.placeholder.com/60x60/F8F9FA/333?text=游볰
dai_031_1099,Whipping Cream,12966857391,face_031,"Premium whipping cream, great taste and quality",3.84,each,Dairy,Tillamook,https://via.placeholder.com/60x60/F8F9FA/333?text=游
mea_032_4252,Rotisserie Chicken,25215047081,face_032,"Fresh rotisserie chicken, USDA inspected",8.3,lb,Meat,Tyson,https://via.placeholder.com/60x60/F8F9FA/333?text=游꼥
mea_032_7824,Chicken Drumsticks,28950091974,face_032,"Fresh chicken drumsticks, USDA inspected",8.99,lb,Meat,Oscar Mayer,https://via.placeholder.com/60x60/F8F9FA/333?text=游꼥
mea_032_2598,Ground Chicken,21706253309,face_032,"Fresh ground chicken, USDA inspected",3.05,lb,Meat,Johnsonville,https://via.placeholder.com/60x60/F8F9FA/333?text=游꼥
mea_032_9850,Chicken Patties,25857650847,face_032,"Fresh chicken patties, USDA inspected",3.25,lb,Meat,Tyson,https://via.placeholder.com/60x60/F8F9FA/333?text=游꼥
mea_032_4536,Chicken Hot Dogs,20342585552,face_032,"Fresh chicken hot dogs, USDA inspected",7.09,lb,Meat,Oscar Mayer,https://via.placeholder.com/60x60/F8F9FA/333?text=游꼥
mea_032_7263,Chicken Sausage,24730970490,face_032,"Fresh chicken sausage, USDA inspected",5.18,lb,Meat,Perdue,https://via.placeholder.com/60x60/F8F9FA/333?text=游꼥
mea_032_2008,Chicken Thighs,29181738908,face_032,"Fresh chicken thighs, USDA inspected",3.01,lb,Meat,Oscar Mayer,https://via.placeholder.com/60x60/F8F9FA/333?text=游꼥
mea_032_2048,Chicken Wings,27376603242,face_032,"Fresh chicken wings, USDA inspected",7.85,lb,Meat,Johnsonville,https://via.placeholder.com/60x60/F8F9FA/333?text=游꼥
mea_032_7596,Chicken Cutlets,25600695740,face_032,"Fresh chicken cutlets, USDA inspected",4.37,lb,Meat,Smithfield,https://via.placeholder.com/60x60/F8F9FA/333?text=游꼥
mea_032_5696,Whole Chicken,28531436528,face_032,"Fresh whole chicken, USDA inspected",5.13,lb,Meat,Boar's Head,https://via.placeholder.com/60x60/F8F9FA/333?text=游꼥
mea_032_2533,Chicken Tenders,24579229695,face_032,"Fresh chicken tenders, USDA inspected",8.19,lb,Meat,Oscar Mayer,https://via.placeholder.com/60x60/F8F9FA/333?text=游꼥
mea_032_7570,Chicken Nuggets,24466360234,face_032,"Fresh chicken nuggets, USDA inspected",4.1,lb,Meat,Perdue,https://via.placeholder.com/60x60/F8F9FA/333?text=游꼥
mea_032_7436,Bone-in Chicken Breast,24232082564,face_032,"Fresh bone-in chicken breast, USDA inspected",6.41,lb,Meat,Fresh Market,https://via.placeholder.com/60x60/F8F9FA/333?text=游꼥
mea_032_1366,Boneless Chicken Breast,28245216427,face_032,"Fresh boneless chicken breast, USDA inspected",4.18,lb,Meat,Hillshire Farm,https://via.placeholder.com/60x60/F8F9FA/333?text=游꼥
bak_033_3624,Eclairs,11217454481,face_033,"Fresh baked eclairs, made daily",5.35,each,Bakery,Wonder Bread,https://via.placeholder.com/60x60/F8F9FA/333?text=游
bak_033_3295,Cannoli,09871168334,face_033,"Fresh baked cannoli, made daily",7.8,each,Bakery,La Brea,https://via.placeholder.com/60x60/F8F9FA/333?text=游
bak_033_8585,Sugar Cookies,13560403237,face_033,"Fresh baked sugar cookies, made daily",3.85,each,Bakery,Wonder Bread,https://via.placeholder.com/60x60/F8F9FA/333?text=游꼵
bak_033_8203,Tiramisu,14425371504,face_033,"Fresh baked tiramisu, made daily",4.4,each,Bakery,Bakery Fresh,https://via.placeholder.com/60x60/F8F9FA/333?text=游
bak_033_9719,Cheesecake,13725922256,face_033,"Fresh baked cheesecake, made daily",4.21,each,Bakery,Bakery Fresh,https://via.placeholder.com/60x60/F8F9FA/333?text=游
bak_033_5381,Chocolate Chip Cookies,09865290977,face_033,"Fresh baked chocolate chip cookies, made daily",8.28,each,Bakery,Sara Lee,https://via.placeholder.com/60x60/F8F9FA/333?text=游꼵
bak_033_2847,Peanut Butter Cookies,09403203263,face_033,"Fresh baked peanut butter cookies, made daily",7.1,each,Bakery,Pepperidge Farm,https://via.placeholder.com/60x60/F8F9FA/333?text=游븯
bak_033_6923,Cakes,09115991599,face_033,"Fresh baked cakes, made daily",4.89,each,Bakery,Wonder Bread,https://via.placeholder.com/60x60/F8F9FA/333?text=游
bak_033_4565,Oatmeal Cookies,15636193179,face_033,"Fresh baked oatmeal cookies, made daily",8.93,each,Bakery,La Brea,https://via.placeholder.com/60x60/F8F9FA/333?text=游꼵
bak_033_3218,Cupcakes,14548663981,face_033,"Fresh baked cupcakes, made daily",4.51,each,Bakery,La Brea,https://via.placeholder.com/60x60/F8F9FA/333?text=游
bak_033_1913,Macarons,10879123523,face_033,"Fresh baked macarons, made daily",6.84,each,Bakery,La Brea,https://via.placeholder.com/60x60/F8F9FA/333?text=游
bak_033_1841,Donuts,13794514441,face_033,"Fresh baked donuts, made daily",5.03,each,Bakery,Thomas',https://via.placeholder.com/60x60/F8F9FA/333?text=游
bak_033_5603,Muffins,09389139878,face_033,"Fresh baked muffins, made daily",5.54,each,Bakery,Wonder Bread,https://via.placeholder.com/60x60/F8F9FA/333?text=游븨
bak_033_6653,Brownies,10881925427,face_033,"Fresh baked brownies, made daily",3.95,each,Bakery,Thomas',https://via.placeholder.com/60x60/F8F9FA/333?text=游
bak_033_5530,Pies,15419500069,face_033,"Fresh baked pies, made daily",6.04,each,Bakery,King's Hawaiian,https://via.placeholder.com/60x60/F8F9FA/333?text=游
pan_034_5021,Spaghetti,34544968752,face_034,"High quality spaghetti, long shelf life",5.59,each,Pantry,Bush's,https://via.placeholder.com/60x60/F8F9FA/333?text=游
pan_034_2069,Quinoa,38429745062,face_034,"High quality quinoa, long shelf life",3.83,each,Pantry,Progresso,https://via.placeholder.com/60x60/F8F9FA/333?text=游
pan_034_6154,Penne,31203980679,face_034,"High quality penne, long shelf life",3.77,each,Pantry,Del Monte,https://via.placeholder.com/60x60/F8F9FA/333?text=游
pan_034_7628,Basmati Rice,35373767534,face_034,"High quality basmati rice, long shelf life",6.48,each,Pantry,Campbell's,https://via.placeholder.com/60x60/F8F9FA/333?text=游꼨
pan_034_7520,Black Beans,37416563178,face_034,"High quality black beans, long shelf life",4.77,each,Pantry,Hunt's,https://via.placeholder.com/60x60/F8F9FA/333?text=游삊
pan_034_9717,Jasmine Rice,30318066455,face_034,"High quality jasmine rice, long shelf life",3.33,each,Pantry,Heinz,https://via.placeholder.com/60x60/F8F9FA/333?text=游꼨
pan_034_1724,Chickpeas,39594390389,face_034,"High quality chickpeas, long shelf life",2.32,each,Pantry,Campbell's,https://via.placeholder.com/60x60/F8F9FA/333?text=游
pan_034_9625,Rigatoni,35304224101,face_034,"High quality rigatoni, long shelf life",5.89,each,Pantry,Uncle Ben's,https://via.placeholder.com/60x60/F8F9FA/333?text=游
pan_034_4948,Brown Rice,39757165504,face_034,"High quality brown rice, long shelf life",2.7,each,Pantry,Progresso,https://via.placeholder.com/60x60/F8F9FA/333?text=游꼨
pan_034_2306,Kidney Beans,30784780048,face_034,"High quality kidney beans, long shelf life",6.05,each,Pantry,Heinz,https://via.placeholder.com/60x60/F8F9FA/333?text=游삊
pan_034_7283,Pinto Beans,38737880271,face_034,"High quality pinto beans, long shelf life",3.26,each,Pantry,Bush's,https://via.placeholder.com/60x60/F8F9FA/333?text=游삊
pan_034_8533,Pasta,38820025833,face_034,"High quality pasta, long shelf life",4.06,each,Pantry,Heinz,https://via.placeholder.com/60x60/F8F9FA/333?text=游꼫
pan_034_5114,Couscous,37472869261,face_034,"High quality couscous, long shelf life",2.82,each,Pantry,Bush's,https://via.placeholder.com/60x60/F8F9FA/333?text=游
pan_034_2921,White Rice,34279133074,face_034,"High quality white rice, long shelf life",2.65,each,Pantry,Great Value,https://via.placeholder.com/60x60/F8F9FA/333?text=游꼨
pan_034_3353,Lentils,31633778706,face_034,"High quality lentils, long shelf life",3.07,each,Pantry,Bush's,https://via.placeholder.com/60x60/F8F9FA/333?text=游
pro_035_4197,Arugula,8503,face_035,"Fresh arugula, premium quality",1.5,lb,Produce,Dole,https://via.placeholder.com/60x60/F8F9FA/333?text=游
pro_035_3616,Fresh Sage,4798,face_035,"Fresh fresh sage, premium quality",1.04,lb,Produce,Chiquita,https://via.placeholder.com/60x60/F8F9FA/333?text=游
pro_035_4191,Collard Greens,6156,face_035,"Fresh collard greens, premium quality",3.9,lb,Produce,Chiquita,https://via.placeholder.com/60x60/F8F9FA/333?text=游
pro_035_3630,Fresh Mint,5150,face_035,"Fresh fresh mint, premium quality",2.51,lb,Produce,Earthbound Farm,https://via.placeholder.com/60x60/F8F9FA/333?text=游
pro_035_2423,Fresh Oregano,8301,face_035,"Fresh fresh oregano, premium quality",1.78,lb,Produce,Del Monte,https://via.placeholder.com/60x60/F8F9FA/333?text=游
pro_035_3465,Fresh Thyme,5574,face_035,"Fresh fresh thyme, premium quality",1.02,lb,Produce,Organic Valley,https://via.placeholder.com/60x60/F8F9FA/333?text=游
pro_035_6953,Swiss Chard,9890,face_035,"Fresh swiss chard, premium quality",2.86,lb,Produce,Dole,https://via.placeholder.com/60x60/F8F9FA/333?text=游
pro_035_4142,Green Cabbage,9619,face_035,"Fresh green cabbage, premium quality",4.58,lb,Produce,Del Monte,https://via.placeholder.com/60x60/F8F9FA/333?text=游
pro_035_8772,Bok Choy,8301,face_035,"Fresh bok choy, premium quality",4.02,lb,Produce,Dole,https://via.placeholder.com/60x60/F8F9FA/333?text=游
pro_035_2908,Kale,9538,face_035,"Fresh kale, premium quality",2.65,lb,Produce,Organic Valley,https://via.placeholder.com/60x60/F8F9FA/333?text=游
pro_035_7765,Fresh Rosemary,5327,face_035,"Fresh fresh rosemary, premium quality",1.57,lb,Produce,Earthbound Farm,https://via.placeholder.com/60x60/F8F9FA/333?text=游
pro_035_9233,Napa Cabbage,8637,face_035,"Fresh napa cabbage, premium quality",3.96,lb,Produce,Del Monte,https://via.placeholder.com/60x60/F8F9FA/333?text=游
pro_035_9750,Baby Spinach,4287,face_035,"Fresh baby spinach, premium quality",1.56,lb,Produce,Driscoll's,https://via.placeholder.com/60x60/F8F9FA/333?text=游볿
pro_035_3338,Fresh Dill,5636,face_035,"Fresh fresh dill, premium quality",1.0,lb,Produce,Driscoll's,https://via.placeholder.com/60x60/F8F9FA/333?text=游
pro_035_4664,Mustard Greens,5355,face_035,"Fresh mustard greens, premium quality",2.84,lb,Produce,Earthbound Farm,https://via.placeholder.com/60x60/F8F9FA/333?text=游
pro_035_4547,Fresh Chives,4548,face_035,"Fresh fresh chives, premium quality",3.26,lb,Produce,Fresh Harvest,https://via.placeholder.com/60x60/F8F9FA/333?text=游
pro_035_7010,Red Cabbage,6247,face_035,"Fresh red cabbage, premium quality",3.77,lb,Produce,Earthbound Farm,https://via.placeholder.com/60x60/F8F9FA/333?text=游
pro_035_1379,Fresh Cilantro,4269,face_035,"Fresh fresh cilantro, premium quality",3.71,lb,Produce,Earthbound Farm,https://via.placeholder.com/60x60/F8F9FA/333?text=游
pro_035_5364,Fresh Basil,6244,face_035,"Fresh fresh basil, premium quality",3.92,lb,Produce,Del Monte,https://via.placeholder.com/60x60/F8F9FA/333?text=游
pro_035_2931,Fresh Parsley,7884,face_035,"Fresh fresh parsley, premium quality",1.25,lb,Produce,Chiquita,https://via.placeholder.com/60x60/F8F9FA/333?text=游
