item_id,name,barcode,face_id,description,price,unit,category,brand,image_url
pro_090_4184,Blood Oranges,8614,face_090,"Fresh blood oranges, premium quality",3.63,lb,Produce,Del Monte,https://via.placeholder.com/60x60/F8F9FA/333?text=游꼙
pro_090_7715,Red Grapes,7946,face_090,"Fresh red grapes, premium quality",1.76,lb,Produce,Chiquita,https://via.placeholder.com/60x60/F8F9FA/333?text=游꼖
pro_090_9746,Raspberries,7181,face_090,"Fresh raspberries, premium quality",2.62,lb,Produce,Chiquita,https://via.placeholder.com/60x60/F8F9FA/333?text=游
pro_090_4535,Papaya,7379,face_090,"Fresh papaya, premium quality",3.59,lb,Produce,Local Farm,https://via.placeholder.com/60x60/F8F9FA/333?text=游
pro_090_6886,Navel Oranges,6885,face_090,"Fresh navel oranges, premium quality",3.03,lb,Produce,Driscoll's,https://via.placeholder.com/60x60/F8F9FA/333?text=游꼙
pro_090_6277,Bananas,8303,face_090,"Fresh bananas, premium quality",2.15,lb,Produce,Fresh Harvest,https://via.placeholder.com/60x60/F8F9FA/333?text=游꼛
pro_090_9441,Red Delicious Apples,9883,face_090,"Fresh red delicious apples, premium quality",4.3,lb,Produce,Organic Valley,https://via.placeholder.com/60x60/F8F9FA/333?text=游꼝
pro_090_3941,Granny Smith Apples,5648,face_090,"Fresh granny smith apples, premium quality",2.49,lb,Produce,Local Farm,https://via.placeholder.com/60x60/F8F9FA/333?text=游꼝
pro_090_4929,Blackberries,8367,face_090,"Fresh blackberries, premium quality",1.77,lb,Produce,Del Monte,https://via.placeholder.com/60x60/F8F9FA/333?text=游
pro_090_6385,Clementines,8534,face_090,"Fresh clementines, premium quality",3.82,lb,Produce,Fresh Harvest,https://via.placeholder.com/60x60/F8F9FA/333?text=游
pro_090_6924,Dragon Fruit,7186,face_090,"Fresh dragon fruit, premium quality",1.88,lb,Produce,Fresh Harvest,https://via.placeholder.com/60x60/F8F9FA/333?text=游
pro_090_5186,Kiwi,6712,face_090,"Fresh kiwi, premium quality",1.53,lb,Produce,Dole,https://via.placeholder.com/60x60/F8F9FA/333?text=游
pro_090_1286,Organic Bananas,8927,face_090,"Fresh organic bananas, premium quality",3.06,lb,Produce,Driscoll's,https://via.placeholder.com/60x60/F8F9FA/333?text=游꼛
pro_090_9040,Strawberries,5483,face_090,"Fresh strawberries, premium quality",4.59,lb,Produce,Del Monte,https://via.placeholder.com/60x60/F8F9FA/333?text=游
pro_090_4693,Plantains,9233,face_090,"Fresh plantains, premium quality",0.88,lb,Produce,Earthbound Farm,https://via.placeholder.com/60x60/F8F9FA/333?text=游
pro_090_2592,Valencia Oranges,5937,face_090,"Fresh valencia oranges, premium quality",4.54,lb,Produce,Dole,https://via.placeholder.com/60x60/F8F9FA/333?text=游꼙
pro_090_4307,Cavendish Bananas,8330,face_090,"Fresh cavendish bananas, premium quality",1.08,lb,Produce,Fresh Harvest,https://via.placeholder.com/60x60/F8F9FA/333?text=游꼛
pro_090_3971,Gala Apples,4832,face_090,"Fresh gala apples, premium quality",2.01,lb,Produce,Local Farm,https://via.placeholder.com/60x60/F8F9FA/333?text=游꼝
dai_091_5513,Organic Eggs,06896771139,face_091,"Premium organic eggs, great taste and quality",3.41,each,Dairy,Chobani,https://via.placeholder.com/60x60/F8F9FA/333?text=游볰
dai_091_7666,Half and Half,05332666016,face_091,"Premium half and half, great taste and quality",2.11,each,Dairy,Tillamook,https://via.placeholder.com/60x60/F8F9FA/333?text=游
dai_091_1047,Heavy Cream,10410224838,face_091,"Premium heavy cream, great taste and quality",3.67,each,Dairy,Great Value,https://via.placeholder.com/60x60/F8F9FA/333?text=游
dai_091_2966,Sour Cream,04309670293,face_091,"Premium sour cream, great taste and quality",3.97,each,Dairy,Land O'Lakes,https://via.placeholder.com/60x60/F8F9FA/333?text=游
dai_091_9233,Buttermilk,08712651231,face_091,"Premium buttermilk, great taste and quality",4.11,each,Dairy,Philadelphia,https://via.placeholder.com/60x60/F8F9FA/333?text=游볱
dai_091_2896,Free Range Eggs,01402372536,face_091,"Premium free range eggs, great taste and quality",4.43,each,Dairy,Land O'Lakes,https://via.placeholder.com/60x60/F8F9FA/333?text=游볰
dai_091_5331,Extra Large Eggs,01949614971,face_091,"Premium extra large eggs, great taste and quality",2.12,each,Dairy,Daisy,https://via.placeholder.com/60x60/F8F9FA/333?text=游볰
dai_091_6230,Egg Whites,05359585936,face_091,"Premium egg whites, great taste and quality",3.53,each,Dairy,Great Value,https://via.placeholder.com/60x60/F8F9FA/333?text=游볰
dai_091_5410,Liquid Eggs,04476335629,face_091,"Premium liquid eggs, great taste and quality",3.1,each,Dairy,Organic Valley,https://via.placeholder.com/60x60/F8F9FA/333?text=游볰
dai_091_5276,Condensed Milk,04412393330,face_091,"Premium condensed milk, great taste and quality",2.95,each,Dairy,Kraft,https://via.placeholder.com/60x60/F8F9FA/333?text=游볱
dai_091_4404,Jumbo Eggs,04818519494,face_091,"Premium jumbo eggs, great taste and quality",4.05,each,Dairy,Kraft,https://via.placeholder.com/60x60/F8F9FA/333?text=游볰
dai_091_4055,Cage Free Eggs,01666453240,face_091,"Premium cage free eggs, great taste and quality",2.11,each,Dairy,Tillamook,https://via.placeholder.com/60x60/F8F9FA/333?text=游볰
dai_091_3229,Whipping Cream,07824616894,face_091,"Premium whipping cream, great taste and quality",3.39,each,Dairy,Daisy,https://via.placeholder.com/60x60/F8F9FA/333?text=游
dai_091_3624,Large Eggs,06872905944,face_091,"Premium large eggs, great taste and quality",2.37,each,Dairy,Kraft,https://via.placeholder.com/60x60/F8F9FA/333?text=游볰
dai_091_6093,Light Cream,03864024405,face_091,"Premium light cream, great taste and quality",3.46,each,Dairy,Daisy,https://via.placeholder.com/60x60/F8F9FA/333?text=游
dai_091_9180,Evaporated Milk,02932577887,face_091,"Premium evaporated milk, great taste and quality",3.3,each,Dairy,Land O'Lakes,https://via.placeholder.com/60x60/F8F9FA/333?text=游볱
mea_092_2472,Whole Chicken,20460862462,face_092,"Fresh whole chicken, USDA inspected",3.01,lb,Meat,Butterball,https://via.placeholder.com/60x60/F8F9FA/333?text=游꼥
mea_092_4618,Chicken Thighs,22349906736,face_092,"Fresh chicken thighs, USDA inspected",4.99,lb,Meat,Butterball,https://via.placeholder.com/60x60/F8F9FA/333?text=游꼥
mea_092_9104,Chicken Tenders,27303746928,face_092,"Fresh chicken tenders, USDA inspected",8.55,lb,Meat,Butterball,https://via.placeholder.com/60x60/F8F9FA/333?text=游꼥
mea_092_1388,Chicken Wings,25592157696,face_092,"Fresh chicken wings, USDA inspected",5.19,lb,Meat,Oscar Mayer,https://via.placeholder.com/60x60/F8F9FA/333?text=游꼥
mea_092_6035,Bone-in Chicken Breast,24328207390,face_092,"Fresh bone-in chicken breast, USDA inspected",3.09,lb,Meat,Johnsonville,https://via.placeholder.com/60x60/F8F9FA/333?text=游꼥
mea_092_3839,Ground Chicken,29154656225,face_092,"Fresh ground chicken, USDA inspected",3.29,lb,Meat,Boar's Head,https://via.placeholder.com/60x60/F8F9FA/333?text=游꼥
mea_092_1019,Chicken Patties,20537022184,face_092,"Fresh chicken patties, USDA inspected",7.81,lb,Meat,Smithfield,https://via.placeholder.com/60x60/F8F9FA/333?text=游꼥
mea_092_2269,Chicken Cutlets,27785454792,face_092,"Fresh chicken cutlets, USDA inspected",6.85,lb,Meat,Tyson,https://via.placeholder.com/60x60/F8F9FA/333?text=游꼥
mea_092_5226,Rotisserie Chicken,28256818970,face_092,"Fresh rotisserie chicken, USDA inspected",5.69,lb,Meat,Fresh Market,https://via.placeholder.com/60x60/F8F9FA/333?text=游꼥
mea_092_9513,Chicken Hot Dogs,25410232521,face_092,"Fresh chicken hot dogs, USDA inspected",5.83,lb,Meat,Johnsonville,https://via.placeholder.com/60x60/F8F9FA/333?text=游꼥
mea_092_9480,Chicken Nuggets,29141853028,face_092,"Fresh chicken nuggets, USDA inspected",3.14,lb,Meat,Butterball,https://via.placeholder.com/60x60/F8F9FA/333?text=游꼥
mea_092_1755,Boneless Chicken Breast,20296577589,face_092,"Fresh boneless chicken breast, USDA inspected",4.43,lb,Meat,Tyson,https://via.placeholder.com/60x60/F8F9FA/333?text=游꼥
mea_092_5985,Chicken Sausage,24390413818,face_092,"Fresh chicken sausage, USDA inspected",3.89,lb,Meat,Oscar Mayer,https://via.placeholder.com/60x60/F8F9FA/333?text=游꼥
mea_092_6541,Chicken Drumsticks,20609686116,face_092,"Fresh chicken drumsticks, USDA inspected",7.62,lb,Meat,Johnsonville,https://via.placeholder.com/60x60/F8F9FA/333?text=游꼥
bak_093_7436,Brownies,07787355148,face_093,"Fresh baked brownies, made daily",3.48,each,Bakery,Sara Lee,https://via.placeholder.com/60x60/F8F9FA/333?text=游
bak_093_1826,Eclairs,15114334557,face_093,"Fresh baked eclairs, made daily",6.24,each,Bakery,Pepperidge Farm,https://via.placeholder.com/60x60/F8F9FA/333?text=游
bak_093_4538,Chocolate Chip Cookies,14167415500,face_093,"Fresh baked chocolate chip cookies, made daily",5.13,each,Bakery,Wonder Bread,https://via.placeholder.com/60x60/F8F9FA/333?text=游꼵
bak_093_4015,Cheesecake,09538773735,face_093,"Fresh baked cheesecake, made daily",8.12,each,Bakery,King's Hawaiian,https://via.placeholder.com/60x60/F8F9FA/333?text=游
bak_093_6401,Tiramisu,13617123076,face_093,"Fresh baked tiramisu, made daily",8.26,each,Bakery,Bakery Select,https://via.placeholder.com/60x60/F8F9FA/333?text=游
bak_093_1114,Oatmeal Cookies,10924240609,face_093,"Fresh baked oatmeal cookies, made daily",3.24,each,Bakery,Thomas',https://via.placeholder.com/60x60/F8F9FA/333?text=游꼵
bak_093_6015,Macarons,15856373457,face_093,"Fresh baked macarons, made daily",5.84,each,Bakery,Wonder Bread,https://via.placeholder.com/60x60/F8F9FA/333?text=游
bak_093_2556,Pies,12539370623,face_093,"Fresh baked pies, made daily",3.29,each,Bakery,Bakery Fresh,https://via.placeholder.com/60x60/F8F9FA/333?text=游
bak_093_1596,Sugar Cookies,09545302303,face_093,"Fresh baked sugar cookies, made daily",4.22,each,Bakery,Bakery Fresh,https://via.placeholder.com/60x60/F8F9FA/333?text=游꼵
bak_093_9904,Cakes,14253818672,face_093,"Fresh baked cakes, made daily",7.84,each,Bakery,Sara Lee,https://via.placeholder.com/60x60/F8F9FA/333?text=游
bak_093_3216,Donuts,12123506707,face_093,"Fresh baked donuts, made daily",3.74,each,Bakery,Thomas',https://via.placeholder.com/60x60/F8F9FA/333?text=游
bak_093_8889,Cupcakes,08300858046,face_093,"Fresh baked cupcakes, made daily",7.51,each,Bakery,Pepperidge Farm,https://via.placeholder.com/60x60/F8F9FA/333?text=游
bak_093_5420,Muffins,14795637171,face_093,"Fresh baked muffins, made daily",5.01,each,Bakery,Wonder Bread,https://via.placeholder.com/60x60/F8F9FA/333?text=游븨
bak_093_3658,Cannoli,12384246546,face_093,"Fresh baked cannoli, made daily",3.47,each,Bakery,King's Hawaiian,https://via.placeholder.com/60x60/F8F9FA/333?text=游
bak_093_8938,Peanut Butter Cookies,11874790934,face_093,"Fresh baked peanut butter cookies, made daily",6.74,each,Bakery,La Brea,https://via.placeholder.com/60x60/F8F9FA/333?text=游븯
pan_094_6230,Pasta,30459624701,face_094,"High quality pasta, long shelf life",2.38,each,Pantry,Progresso,https://via.placeholder.com/60x60/F8F9FA/333?text=游꼫
pan_094_3471,Black Beans,37797456312,face_094,"High quality black beans, long shelf life",6.49,each,Pantry,Great Value,https://via.placeholder.com/60x60/F8F9FA/333?text=游삊
pan_094_3773,White Rice,32193212394,face_094,"High quality white rice, long shelf life",2.23,each,Pantry,Del Monte,https://via.placeholder.com/60x60/F8F9FA/333?text=游꼨
pan_094_1669,Spaghetti,33523891366,face_094,"High quality spaghetti, long shelf life",2.07,each,Pantry,Great Value,https://via.placeholder.com/60x60/F8F9FA/333?text=游
pan_094_5561,Couscous,31845265348,face_094,"High quality couscous, long shelf life",6.42,each,Pantry,Uncle Ben's,https://via.placeholder.com/60x60/F8F9FA/333?text=游
pan_094_2383,Jasmine Rice,36119363488,face_094,"High quality jasmine rice, long shelf life",3.64,each,Pantry,Goya,https://via.placeholder.com/60x60/F8F9FA/333?text=游꼨
pan_094_6831,Basmati Rice,32849688277,face_094,"High quality basmati rice, long shelf life",2.78,each,Pantry,Heinz,https://via.placeholder.com/60x60/F8F9FA/333?text=游꼨
pan_094_3634,Brown Rice,38252726584,face_094,"High quality brown rice, long shelf life",3.42,each,Pantry,Hunt's,https://via.placeholder.com/60x60/F8F9FA/333?text=游꼨
pan_094_8493,Rigatoni,36524651371,face_094,"High quality rigatoni, long shelf life",3.26,each,Pantry,Goya,https://via.placeholder.com/60x60/F8F9FA/333?text=游
pan_094_9917,Quinoa,33152594028,face_094,"High quality quinoa, long shelf life",6.86,each,Pantry,Progresso,https://via.placeholder.com/60x60/F8F9FA/333?text=游
pan_094_8055,Lentils,39610663625,face_094,"High quality lentils, long shelf life",3.66,each,Pantry,Kraft,https://via.placeholder.com/60x60/F8F9FA/333?text=游
pan_094_5833,Kidney Beans,37485844656,face_094,"High quality kidney beans, long shelf life",6.93,each,Pantry,Hunt's,https://via.placeholder.com/60x60/F8F9FA/333?text=游삊
pan_094_8234,Chickpeas,32969136186,face_094,"High quality chickpeas, long shelf life",3.44,each,Pantry,Del Monte,https://via.placeholder.com/60x60/F8F9FA/333?text=游
pan_094_4590,Penne,35168352518,face_094,"High quality penne, long shelf life",4.63,each,Pantry,Bush's,https://via.placeholder.com/60x60/F8F9FA/333?text=游
pan_094_6596,Pinto Beans,39283919032,face_094,"High quality pinto beans, long shelf life",2.97,each,Pantry,Heinz,https://via.placeholder.com/60x60/F8F9FA/333?text=游삊
pro_095_3048,Swiss Chard,6943,face_095,"Fresh swiss chard, premium quality",4.31,lb,Produce,Driscoll's,https://via.placeholder.com/60x60/F8F9FA/333?text=游
pro_095_8231,Red Cabbage,7661,face_095,"Fresh red cabbage, premium quality",2.0,lb,Produce,Local Farm,https://via.placeholder.com/60x60/F8F9FA/333?text=游
pro_095_3500,Fresh Thyme,4563,face_095,"Fresh fresh thyme, premium quality",3.99,lb,Produce,Fresh Harvest,https://via.placeholder.com/60x60/F8F9FA/333?text=游
pro_095_7247,Green Cabbage,5722,face_095,"Fresh green cabbage, premium quality",2.46,lb,Produce,Dole,https://via.placeholder.com/60x60/F8F9FA/333?text=游
pro_095_4459,Mustard Greens,7310,face_095,"Fresh mustard greens, premium quality",4.73,lb,Produce,Chiquita,https://via.placeholder.com/60x60/F8F9FA/333?text=游
pro_095_1363,Arugula,7509,face_095,"Fresh arugula, premium quality",4.22,lb,Produce,Chiquita,https://via.placeholder.com/60x60/F8F9FA/333?text=游
pro_095_4768,Fresh Cilantro,8941,face_095,"Fresh fresh cilantro, premium quality",3.56,lb,Produce,Del Monte,https://via.placeholder.com/60x60/F8F9FA/333?text=游
pro_095_5847,Fresh Basil,7762,face_095,"Fresh fresh basil, premium quality",2.6,lb,Produce,Earthbound Farm,https://via.placeholder.com/60x60/F8F9FA/333?text=游
pro_095_4850,Kale,6554,face_095,"Fresh kale, premium quality",4.43,lb,Produce,Earthbound Farm,https://via.placeholder.com/60x60/F8F9FA/333?text=游
pro_095_3068,Fresh Sage,9495,face_095,"Fresh fresh sage, premium quality",1.05,lb,Produce,Chiquita,https://via.placeholder.com/60x60/F8F9FA/333?text=游
pro_095_2329,Fresh Dill,4348,face_095,"Fresh fresh dill, premium quality",1.65,lb,Produce,Del Monte,https://via.placeholder.com/60x60/F8F9FA/333?text=游
pro_095_8618,Baby Spinach,8991,face_095,"Fresh baby spinach, premium quality",4.7,lb,Produce,Dole,https://via.placeholder.com/60x60/F8F9FA/333?text=游볿
pro_095_6255,Fresh Parsley,6791,face_095,"Fresh fresh parsley, premium quality",4.68,lb,Produce,Earthbound Farm,https://via.placeholder.com/60x60/F8F9FA/333?text=游
pro_095_4481,Bok Choy,9874,face_095,"Fresh bok choy, premium quality",2.39,lb,Produce,Organic Valley,https://via.placeholder.com/60x60/F8F9FA/333?text=游
pro_095_1854,Fresh Oregano,9782,face_095,"Fresh fresh oregano, premium quality",1.71,lb,Produce,Del Monte,https://via.placeholder.com/60x60/F8F9FA/333?text=游
pro_095_1796,Fresh Mint,9587,face_095,"Fresh fresh mint, premium quality",3.44,lb,Produce,Del Monte,https://via.placeholder.com/60x60/F8F9FA/333?text=游
pro_095_4032,Napa Cabbage,6623,face_095,"Fresh napa cabbage, premium quality",4.41,lb,Produce,Local Farm,https://via.placeholder.com/60x60/F8F9FA/333?text=游
pro_095_1410,Collard Greens,9535,face_095,"Fresh collard greens, premium quality",4.77,lb,Produce,Organic Valley,https://via.placeholder.com/60x60/F8F9FA/333?text=游
pro_095_7527,Fresh Rosemary,4946,face_095,"Fresh fresh rosemary, premium quality",2.98,lb,Produce,Earthbound Farm,https://via.placeholder.com/60x60/F8F9FA/333?text=游
pro_095_6087,Fresh Chives,7600,face_095,"Fresh fresh chives, premium quality",4.43,lb,Produce,Dole,https://via.placeholder.com/60x60/F8F9FA/333?text=游
dai_096_9477,Cashew Milk,12454336030,face_096,"Premium cashew milk, great taste and quality",5.5,each,Dairy,Organic Valley,https://via.placeholder.com/60x60/F8F9FA/333?text=游볱
dai_096_2100,Hemp Milk,01140450487,face_096,"Premium hemp milk, great taste and quality",3.98,each,Dairy,Horizon Organic,https://via.placeholder.com/60x60/F8F9FA/333?text=游볱
dai_096_3528,Lactose Free Milk,04123972971,face_096,"Premium lactose free milk, great taste and quality",4.09,each,Dairy,Land O'Lakes,https://via.placeholder.com/60x60/F8F9FA/333?text=游볱
dai_096_2595,Organic Whole Milk,08279560576,face_096,"Premium organic whole milk, great taste and quality",4.26,each,Dairy,Philadelphia,https://via.placeholder.com/60x60/F8F9FA/333?text=游볱
dai_096_4118,1% Low Fat Milk,09581847142,face_096,"Premium 1% low fat milk, great taste and quality",5.93,each,Dairy,Tillamook,https://via.placeholder.com/60x60/F8F9FA/333?text=游볱
dai_096_8127,Oat Milk,07326903736,face_096,"Premium oat milk, great taste and quality",4.6,each,Dairy,Organic Valley,https://via.placeholder.com/60x60/F8F9FA/333?text=游볱
dai_096_9204,2% Reduced Fat Milk,01377244403,face_096,"Premium 2% reduced fat milk, great taste and quality",3.98,each,Dairy,Land O'Lakes,https://via.placeholder.com/60x60/F8F9FA/333?text=游볱
dai_096_8341,Soy Milk,10287997841,face_096,"Premium soy milk, great taste and quality",5.76,each,Dairy,Land O'Lakes,https://via.placeholder.com/60x60/F8F9FA/333?text=游볱
dai_096_8805,Organic 2% Milk,07381911105,face_096,"Premium organic 2% milk, great taste and quality",5.14,each,Dairy,Organic Valley,https://via.placeholder.com/60x60/F8F9FA/333?text=游볱
dai_096_9500,Whole Milk,11129923545,face_096,"Premium whole milk, great taste and quality",4.12,each,Dairy,Kraft,https://via.placeholder.com/60x60/F8F9FA/333?text=游볱
dai_096_5131,Coconut Milk,08713060570,face_096,"Premium coconut milk, great taste and quality",3.39,each,Dairy,Great Value,https://via.placeholder.com/60x60/F8F9FA/333?text=游볱
dai_096_3835,Almond Milk,10262393471,face_096,"Premium almond milk, great taste and quality",3.44,each,Dairy,Philadelphia,https://via.placeholder.com/60x60/F8F9FA/333?text=游볱
dai_096_9325,Skim Milk,02170552976,face_096,"Premium skim milk, great taste and quality",4.93,each,Dairy,Horizon Organic,https://via.placeholder.com/60x60/F8F9FA/333?text=游볱
mea_097_9563,Flank Steak,20522410949,face_097,"Fresh flank steak, USDA inspected",12.18,lb,Meat,Boar's Head,https://via.placeholder.com/60x60/F8F9FA/333?text=游
mea_097_9975,Beef Short Ribs,26678824766,face_097,"Fresh beef short ribs, USDA inspected",17.74,lb,Meat,Boar's Head,https://via.placeholder.com/60x60/F8F9FA/333?text=游볼
mea_097_3098,Round Roast,28212169417,face_097,"Fresh round roast, USDA inspected",17.27,lb,Meat,Butterball,https://via.placeholder.com/60x60/F8F9FA/333?text=游
mea_097_9865,Ribeye Steak,21940706904,face_097,"Fresh ribeye steak, USDA inspected",19.55,lb,Meat,Smithfield,https://via.placeholder.com/60x60/F8F9FA/333?text=游
mea_097_9004,Ground Beef 90/10,20467525109,face_097,"Fresh ground beef 90/10, USDA inspected",14.21,lb,Meat,Butterball,https://via.placeholder.com/60x60/F8F9FA/333?text=游볼
mea_097_2526,Strip Steak,27425564403,face_097,"Fresh strip steak, USDA inspected",15.95,lb,Meat,Johnsonville,https://via.placeholder.com/60x60/F8F9FA/333?text=游
mea_097_2721,Porterhouse Steak,24683294627,face_097,"Fresh porterhouse steak, USDA inspected",13.57,lb,Meat,Boar's Head,https://via.placeholder.com/60x60/F8F9FA/333?text=游
mea_097_3106,Chuck Roast,25421212338,face_097,"Fresh chuck roast, USDA inspected",13.31,lb,Meat,Oscar Mayer,https://via.placeholder.com/60x60/F8F9FA/333?text=游
mea_097_8899,Ground Beef 95/5,22964566882,face_097,"Fresh ground beef 95/5, USDA inspected",14.78,lb,Meat,Butterball,https://via.placeholder.com/60x60/F8F9FA/333?text=游볼
mea_097_9533,Skirt Steak,21834233198,face_097,"Fresh skirt steak, USDA inspected",6.81,lb,Meat,Boar's Head,https://via.placeholder.com/60x60/F8F9FA/333?text=游
mea_097_4414,Ground Beef 80/20,29743413571,face_097,"Fresh ground beef 80/20, USDA inspected",7.13,lb,Meat,Hillshire Farm,https://via.placeholder.com/60x60/F8F9FA/333?text=游볼
mea_097_5554,Brisket,20597474793,face_097,"Fresh brisket, USDA inspected",19.42,lb,Meat,Butterball,https://via.placeholder.com/60x60/F8F9FA/333?text=游
mea_097_4223,Beef Stew Meat,26363941384,face_097,"Fresh beef stew meat, USDA inspected",17.12,lb,Meat,Perdue,https://via.placeholder.com/60x60/F8F9FA/333?text=游볼
mea_097_6761,Filet Mignon,24348238365,face_097,"Fresh filet mignon, USDA inspected",14.67,lb,Meat,Butterball,https://via.placeholder.com/60x60/F8F9FA/333?text=游
mea_097_6604,T-Bone Steak,20714474559,face_097,"Fresh t-bone steak, USDA inspected",16.58,lb,Meat,Fresh Market,https://via.placeholder.com/60x60/F8F9FA/333?text=游
mea_097_2849,Ground Beef 93/7,21660438421,face_097,"Fresh ground beef 93/7, USDA inspected",19.63,lb,Meat,Smithfield,https://via.placeholder.com/60x60/F8F9FA/333?text=游볼
bak_098_2559,Whole Wheat Bread,11345798661,face_098,"Fresh baked whole wheat bread, made daily",4.56,each,Bakery,Bakery Select,https://via.placeholder.com/60x60/F8F9FA/333?text=游
bak_098_7887,Flatbread,08882397202,face_098,"Fresh baked flatbread, made daily",2.02,each,Bakery,King's Hawaiian,https://via.placeholder.com/60x60/F8F9FA/333?text=游
bak_098_7990,Pita Bread,10762733709,face_098,"Fresh baked pita bread, made daily",3.08,each,Bakery,Bakery Select,https://via.placeholder.com/60x60/F8F9FA/333?text=游
bak_098_7914,English Muffins,15651492060,face_098,"Fresh baked english muffins, made daily",3.47,each,Bakery,Bakery Fresh,https://via.placeholder.com/60x60/F8F9FA/333?text=游븨
bak_098_3385,Sourdough Bread,14569907957,face_098,"Fresh baked sourdough bread, made daily",3.1,each,Bakery,Wonder Bread,https://via.placeholder.com/60x60/F8F9FA/333?text=游
bak_098_3462,Dinner Rolls,09301113001,face_098,"Fresh baked dinner rolls, made daily",4.66,each,Bakery,King's Hawaiian,https://via.placeholder.com/60x60/F8F9FA/333?text=游
bak_098_9207,Tortillas,11673331990,face_098,"Fresh baked tortillas, made daily",3.54,each,Bakery,La Brea,https://via.placeholder.com/60x60/F8F9FA/333?text=游
bak_098_3478,Brioche Bread,09641337662,face_098,"Fresh baked brioche bread, made daily",2.92,each,Bakery,Bakery Fresh,https://via.placeholder.com/60x60/F8F9FA/333?text=游
bak_098_1663,French Bread,09383645968,face_098,"Fresh baked french bread, made daily",4.24,each,Bakery,Thomas',https://via.placeholder.com/60x60/F8F9FA/333?text=游
bak_098_4580,Italian Bread,12488956928,face_098,"Fresh baked italian bread, made daily",2.76,each,Bakery,Sara Lee,https://via.placeholder.com/60x60/F8F9FA/333?text=游
bak_098_8344,Bagels,11813125833,face_098,"Fresh baked bagels, made daily",3.9,each,Bakery,Wonder Bread,https://via.placeholder.com/60x60/F8F9FA/333?text=游
bak_098_5349,Danish Pastries,10613417954,face_098,"Fresh baked danish pastries, made daily",2.41,each,Bakery,Pepperidge Farm,https://via.placeholder.com/60x60/F8F9FA/333?text=游
bak_098_3954,Croissants,13850671359,face_098,"Fresh baked croissants, made daily",2.64,each,Bakery,King's Hawaiian,https://via.placeholder.com/60x60/F8F9FA/333?text=游
bak_098_1508,Naan Bread,07494889454,face_098,"Fresh baked naan bread, made daily",2.24,each,Bakery,Bakery Select,https://via.placeholder.com/60x60/F8F9FA/333?text=游
bak_098_2809,Pumpernickel Bread,08581325004,face_098,"Fresh baked pumpernickel bread, made daily",2.14,each,Bakery,King's Hawaiian,https://via.placeholder.com/60x60/F8F9FA/333?text=游
bak_098_7506,Challah Bread,16122312966,face_098,"Fresh baked challah bread, made daily",4.57,each,Bakery,Bakery Select,https://via.placeholder.com/60x60/F8F9FA/333?text=游
bak_098_6728,Hot Dog Buns,09308170442,face_098,"Fresh baked hot dog buns, made daily",2.85,each,Bakery,Bakery Fresh,https://via.placeholder.com/60x60/F8F9FA/333?text=游
bak_098_8841,Hamburger Buns,10389844947,face_098,"Fresh baked hamburger buns, made daily",2.03,each,Bakery,Wonder Bread,https://via.placeholder.com/60x60/F8F9FA/333?text=游
bak_098_9207,White Bread,16438031428,face_098,"Fresh baked white bread, made daily",2.64,each,Bakery,Bakery Fresh,https://via.placeholder.com/60x60/F8F9FA/333?text=游
bak_098_8424,Multigrain Bread,09247809472,face_098,"Fresh baked multigrain bread, made daily",3.76,each,Bakery,Bakery Select,https://via.placeholder.com/60x60/F8F9FA/333?text=游
bak_098_4229,Rye Bread,16902231966,face_098,"Fresh baked rye bread, made daily",3.81,each,Bakery,Thomas',https://via.placeholder.com/60x60/F8F9FA/333?text=游
pan_099_1640,Canned Beans,33486995397,face_099,"High quality canned beans, long shelf life",3.76,each,Pantry,Hunt's,https://via.placeholder.com/60x60/F8F9FA/333?text=游삊
pan_099_1055,Canned Tuna,34120941693,face_099,"High quality canned tuna, long shelf life",3.36,each,Pantry,Uncle Ben's,https://via.placeholder.com/60x60/F8F9FA/333?text=游
pan_099_3041,Canned Soup,39855844107,face_099,"High quality canned soup, long shelf life",1.23,each,Pantry,Hunt's,https://via.placeholder.com/60x60/F8F9FA/333?text=游볶
pan_099_6879,Canned Green Beans,32682576204,face_099,"High quality canned green beans, long shelf life",2.44,each,Pantry,Kraft,https://via.placeholder.com/60x60/F8F9FA/333?text=游삊
