item_id,name,barcode,face_id,description,price,unit,category,brand,image_url
pan_054_6615,Canned Soup,36167017184,face_054,"High quality canned soup, long shelf life",2.67,each,Pantry,Bush's,https://via.placeholder.com/60x60/F8F9FA/333?text=游볶
pan_054_5503,Canned Green Beans,31382090355,face_054,"High quality canned green beans, long shelf life",2.27,each,Pantry,Del Monte,https://via.placeholder.com/60x60/F8F9FA/333?text=游삊
pan_054_5880,Canned Peas,33704985774,face_054,"High quality canned peas, long shelf life",1.4,each,Pantry,Heinz,https://via.placeholder.com/60x60/F8F9FA/333?text=游
pan_054_9681,Canned Tuna,37606744517,face_054,"High quality canned tuna, long shelf life",2.89,each,Pantry,Campbell's,https://via.placeholder.com/60x60/F8F9FA/333?text=游
pan_054_7958,Canned Vegetables,33753790544,face_054,"High quality canned vegetables, long shelf life",2.81,each,Pantry,Del Monte,https://via.placeholder.com/60x60/F8F9FA/333?text=游
pan_054_2970,Canned Salmon,32149243358,face_054,"High quality canned salmon, long shelf life",2.87,each,Pantry,Kraft,https://via.placeholder.com/60x60/F8F9FA/333?text=游
pan_054_2928,Canned Beans,38528930288,face_054,"High quality canned beans, long shelf life",2.2,each,Pantry,Goya,https://via.placeholder.com/60x60/F8F9FA/333?text=游삊
pan_054_6673,Canned Tomatoes,35330033949,face_054,"High quality canned tomatoes, long shelf life",3.61,each,Pantry,Great Value,https://via.placeholder.com/60x60/F8F9FA/333?text=游꼔
pro_055_3808,Rainbow Carrots,9926,face_055,"Fresh rainbow carrots, premium quality",2.44,lb,Produce,Del Monte,https://via.placeholder.com/60x60/F8F9FA/333?text=游볫
pro_055_4511,White Onions,5157,face_055,"Fresh white onions, premium quality",1.39,lb,Produce,Earthbound Farm,https://via.placeholder.com/60x60/F8F9FA/333?text=游븬
pro_055_5071,Purple Carrots,6588,face_055,"Fresh purple carrots, premium quality",1.11,lb,Produce,Earthbound Farm,https://via.placeholder.com/60x60/F8F9FA/333?text=游볫
pro_055_6185,Yukon Gold Potatoes,4336,face_055,"Fresh yukon gold potatoes, premium quality",1.64,lb,Produce,Local Farm,https://via.placeholder.com/60x60/F8F9FA/333?text=游볪
pro_055_3175,Grape Tomatoes,9175,face_055,"Fresh grape tomatoes, premium quality",2.55,lb,Produce,Del Monte,https://via.placeholder.com/60x60/F8F9FA/333?text=游꼖
pro_055_2627,Red Leaf Lettuce,8175,face_055,"Fresh red leaf lettuce, premium quality",3.58,lb,Produce,Del Monte,https://via.placeholder.com/60x60/F8F9FA/333?text=游볿
pro_055_5587,Beefsteak Tomatoes,5413,face_055,"Fresh beefsteak tomatoes, premium quality",3.64,lb,Produce,Dole,https://via.placeholder.com/60x60/F8F9FA/333?text=游꼔
pro_055_7184,Butter Lettuce,8495,face_055,"Fresh butter lettuce, premium quality",0.83,lb,Produce,Dole,https://via.placeholder.com/60x60/F8F9FA/333?text=游볿
pro_055_2727,Russet Potatoes,8894,face_055,"Fresh russet potatoes, premium quality",1.47,lb,Produce,Dole,https://via.placeholder.com/60x60/F8F9FA/333?text=游볪
pro_055_9282,Red Onions,6904,face_055,"Fresh red onions, premium quality",2.16,lb,Produce,Del Monte,https://via.placeholder.com/60x60/F8F9FA/333?text=游븬
pro_055_9829,Garlic,5156,face_055,"Fresh garlic, premium quality",2.35,lb,Produce,Driscoll's,https://via.placeholder.com/60x60/F8F9FA/333?text=游
pro_055_5096,Cherry Tomatoes,7907,face_055,"Fresh cherry tomatoes, premium quality",0.56,lb,Produce,Earthbound Farm,https://via.placeholder.com/60x60/F8F9FA/333?text=游꼔
pro_055_7537,Pickling Cucumbers,9143,face_055,"Fresh pickling cucumbers, premium quality",1.38,lb,Produce,Earthbound Farm,https://via.placeholder.com/60x60/F8F9FA/333?text=游
pro_055_4277,Regular Carrots,5944,face_055,"Fresh regular carrots, premium quality",1.49,lb,Produce,Dole,https://via.placeholder.com/60x60/F8F9FA/333?text=游볫
pro_055_1782,Shallots,6746,face_055,"Fresh shallots, premium quality",1.17,lb,Produce,Del Monte,https://via.placeholder.com/60x60/F8F9FA/333?text=游
pro_055_2794,Baby Carrots,4717,face_055,"Fresh baby carrots, premium quality",0.84,lb,Produce,Driscoll's,https://via.placeholder.com/60x60/F8F9FA/333?text=游볫
pro_055_1921,Armenian Cucumbers,5488,face_055,"Fresh armenian cucumbers, premium quality",2.88,lb,Produce,Chiquita,https://via.placeholder.com/60x60/F8F9FA/333?text=游
pro_055_4715,Persian Cucumbers,7400,face_055,"Fresh persian cucumbers, premium quality",1.36,lb,Produce,Local Farm,https://via.placeholder.com/60x60/F8F9FA/333?text=游
pro_055_7183,Romaine Lettuce,5628,face_055,"Fresh romaine lettuce, premium quality",0.51,lb,Produce,Organic Valley,https://via.placeholder.com/60x60/F8F9FA/333?text=游볿
pro_055_2050,English Cucumbers,9358,face_055,"Fresh english cucumbers, premium quality",3.78,lb,Produce,Dole,https://via.placeholder.com/60x60/F8F9FA/333?text=游
pro_055_3857,Roma Tomatoes,6510,face_055,"Fresh roma tomatoes, premium quality",3.68,lb,Produce,Driscoll's,https://via.placeholder.com/60x60/F8F9FA/333?text=游꼔
pro_055_9472,Sweet Potatoes,7496,face_055,"Fresh sweet potatoes, premium quality",1.67,lb,Produce,Organic Valley,https://via.placeholder.com/60x60/F8F9FA/333?text=游볪
pro_055_5978,Yellow Onions,5688,face_055,"Fresh yellow onions, premium quality",1.28,lb,Produce,Dole,https://via.placeholder.com/60x60/F8F9FA/333?text=游븬
pro_055_2301,Iceberg Lettuce,5377,face_055,"Fresh iceberg lettuce, premium quality",1.59,lb,Produce,Local Farm,https://via.placeholder.com/60x60/F8F9FA/333?text=游볿
pro_055_1207,Red Potatoes,4129,face_055,"Fresh red potatoes, premium quality",3.77,lb,Produce,Earthbound Farm,https://via.placeholder.com/60x60/F8F9FA/333?text=游볪
dai_056_7929,Almond Milk,04641624806,face_056,"Premium almond milk, great taste and quality",5.89,each,Dairy,Kraft,https://via.placeholder.com/60x60/F8F9FA/333?text=游볱
dai_056_4311,Organic Whole Milk,04315107062,face_056,"Premium organic whole milk, great taste and quality",4.48,each,Dairy,Philadelphia,https://via.placeholder.com/60x60/F8F9FA/333?text=游볱
dai_056_9422,Skim Milk,05929093414,face_056,"Premium skim milk, great taste and quality",5.43,each,Dairy,Chobani,https://via.placeholder.com/60x60/F8F9FA/333?text=游볱
dai_056_2331,1% Low Fat Milk,12190931793,face_056,"Premium 1% low fat milk, great taste and quality",4.19,each,Dairy,Horizon Organic,https://via.placeholder.com/60x60/F8F9FA/333?text=游볱
dai_056_3365,Hemp Milk,03449647882,face_056,"Premium hemp milk, great taste and quality",5.9,each,Dairy,Fage,https://via.placeholder.com/60x60/F8F9FA/333?text=游볱
dai_056_3063,2% Reduced Fat Milk,01151551393,face_056,"Premium 2% reduced fat milk, great taste and quality",3.5,each,Dairy,Fage,https://via.placeholder.com/60x60/F8F9FA/333?text=游볱
dai_056_9349,Soy Milk,03813189928,face_056,"Premium soy milk, great taste and quality",5.48,each,Dairy,Fage,https://via.placeholder.com/60x60/F8F9FA/333?text=游볱
dai_056_2738,Lactose Free Milk,07644707200,face_056,"Premium lactose free milk, great taste and quality",5.96,each,Dairy,Tillamook,https://via.placeholder.com/60x60/F8F9FA/333?text=游볱
dai_056_9030,Cashew Milk,08741440549,face_056,"Premium cashew milk, great taste and quality",5.93,each,Dairy,Tillamook,https://via.placeholder.com/60x60/F8F9FA/333?text=游볱
dai_056_5742,Organic 2% Milk,09122652740,face_056,"Premium organic 2% milk, great taste and quality",4.19,each,Dairy,Great Value,https://via.placeholder.com/60x60/F8F9FA/333?text=游볱
dai_056_5758,Coconut Milk,11534018868,face_056,"Premium coconut milk, great taste and quality",5.71,each,Dairy,Land O'Lakes,https://via.placeholder.com/60x60/F8F9FA/333?text=游볱
dai_056_8520,Oat Milk,05890479515,face_056,"Premium oat milk, great taste and quality",4.75,each,Dairy,Tillamook,https://via.placeholder.com/60x60/F8F9FA/333?text=游볱
dai_056_2271,Whole Milk,03863290396,face_056,"Premium whole milk, great taste and quality",4.91,each,Dairy,Fage,https://via.placeholder.com/60x60/F8F9FA/333?text=游볱
mea_057_2119,Ribeye Steak,28924523767,face_057,"Fresh ribeye steak, USDA inspected",5.4,lb,Meat,Perdue,https://via.placeholder.com/60x60/F8F9FA/333?text=游
mea_057_4843,Brisket,24340863259,face_057,"Fresh brisket, USDA inspected",7.44,lb,Meat,Johnsonville,https://via.placeholder.com/60x60/F8F9FA/333?text=游
mea_057_9484,Beef Short Ribs,29417378395,face_057,"Fresh beef short ribs, USDA inspected",15.15,lb,Meat,Johnsonville,https://via.placeholder.com/60x60/F8F9FA/333?text=游볼
mea_057_3921,Flank Steak,22108074611,face_057,"Fresh flank steak, USDA inspected",17.5,lb,Meat,Hillshire Farm,https://via.placeholder.com/60x60/F8F9FA/333?text=游
mea_057_4927,Porterhouse Steak,27125613656,face_057,"Fresh porterhouse steak, USDA inspected",14.0,lb,Meat,Oscar Mayer,https://via.placeholder.com/60x60/F8F9FA/333?text=游
mea_057_2383,Ground Beef 80/20,28227778767,face_057,"Fresh ground beef 80/20, USDA inspected",11.51,lb,Meat,Tyson,https://via.placeholder.com/60x60/F8F9FA/333?text=游볼
mea_057_4460,Round Roast,22135317122,face_057,"Fresh round roast, USDA inspected",14.85,lb,Meat,Perdue,https://via.placeholder.com/60x60/F8F9FA/333?text=游
mea_057_8007,Ground Beef 93/7,27646924654,face_057,"Fresh ground beef 93/7, USDA inspected",18.49,lb,Meat,Perdue,https://via.placeholder.com/60x60/F8F9FA/333?text=游볼
mea_057_6318,Ground Beef 95/5,20160840016,face_057,"Fresh ground beef 95/5, USDA inspected",9.79,lb,Meat,Oscar Mayer,https://via.placeholder.com/60x60/F8F9FA/333?text=游볼
mea_057_2250,Skirt Steak,29221565823,face_057,"Fresh skirt steak, USDA inspected",9.04,lb,Meat,Smithfield,https://via.placeholder.com/60x60/F8F9FA/333?text=游
mea_057_7254,Chuck Roast,20104136525,face_057,"Fresh chuck roast, USDA inspected",17.04,lb,Meat,Butterball,https://via.placeholder.com/60x60/F8F9FA/333?text=游
mea_057_9772,T-Bone Steak,28299100653,face_057,"Fresh t-bone steak, USDA inspected",17.22,lb,Meat,Smithfield,https://via.placeholder.com/60x60/F8F9FA/333?text=游
mea_057_8234,Ground Beef 90/10,27839912571,face_057,"Fresh ground beef 90/10, USDA inspected",10.92,lb,Meat,Perdue,https://via.placeholder.com/60x60/F8F9FA/333?text=游볼
mea_057_4192,Filet Mignon,28660430007,face_057,"Fresh filet mignon, USDA inspected",6.69,lb,Meat,Fresh Market,https://via.placeholder.com/60x60/F8F9FA/333?text=游
mea_057_5432,Beef Stew Meat,24719545745,face_057,"Fresh beef stew meat, USDA inspected",11.6,lb,Meat,Hillshire Farm,https://via.placeholder.com/60x60/F8F9FA/333?text=游볼
mea_057_8917,Strip Steak,27511818999,face_057,"Fresh strip steak, USDA inspected",7.51,lb,Meat,Fresh Market,https://via.placeholder.com/60x60/F8F9FA/333?text=游
bak_058_6273,Pumpernickel Bread,16211529846,face_058,"Fresh baked pumpernickel bread, made daily",3.93,each,Bakery,King's Hawaiian,https://via.placeholder.com/60x60/F8F9FA/333?text=游
bak_058_1781,French Bread,13485666481,face_058,"Fresh baked french bread, made daily",3.58,each,Bakery,Sara Lee,https://via.placeholder.com/60x60/F8F9FA/333?text=游
bak_058_1919,Challah Bread,07837323900,face_058,"Fresh baked challah bread, made daily",4.82,each,Bakery,Bakery Select,https://via.placeholder.com/60x60/F8F9FA/333?text=游
bak_058_4622,Hot Dog Buns,07686800675,face_058,"Fresh baked hot dog buns, made daily",4.44,each,Bakery,Thomas',https://via.placeholder.com/60x60/F8F9FA/333?text=游
bak_058_9341,Bagels,15398166447,face_058,"Fresh baked bagels, made daily",3.08,each,Bakery,Wonder Bread,https://via.placeholder.com/60x60/F8F9FA/333?text=游
bak_058_1703,Hamburger Buns,13488272271,face_058,"Fresh baked hamburger buns, made daily",4.44,each,Bakery,Wonder Bread,https://via.placeholder.com/60x60/F8F9FA/333?text=游
bak_058_3124,Croissants,07327501947,face_058,"Fresh baked croissants, made daily",4.78,each,Bakery,King's Hawaiian,https://via.placeholder.com/60x60/F8F9FA/333?text=游
bak_058_5886,White Bread,11554499234,face_058,"Fresh baked white bread, made daily",2.0,each,Bakery,La Brea,https://via.placeholder.com/60x60/F8F9FA/333?text=游
bak_058_3488,Multigrain Bread,09159014998,face_058,"Fresh baked multigrain bread, made daily",2.14,each,Bakery,Pepperidge Farm,https://via.placeholder.com/60x60/F8F9FA/333?text=游
bak_058_3631,Whole Wheat Bread,14942457884,face_058,"Fresh baked whole wheat bread, made daily",2.6,each,Bakery,Thomas',https://via.placeholder.com/60x60/F8F9FA/333?text=游
bak_058_5804,Danish Pastries,11272416064,face_058,"Fresh baked danish pastries, made daily",4.54,each,Bakery,Sara Lee,https://via.placeholder.com/60x60/F8F9FA/333?text=游
bak_058_9799,Pita Bread,11666856334,face_058,"Fresh baked pita bread, made daily",3.57,each,Bakery,Sara Lee,https://via.placeholder.com/60x60/F8F9FA/333?text=游
bak_058_5772,Rye Bread,14660718451,face_058,"Fresh baked rye bread, made daily",2.15,each,Bakery,Pepperidge Farm,https://via.placeholder.com/60x60/F8F9FA/333?text=游
bak_058_7038,Flatbread,12914662385,face_058,"Fresh baked flatbread, made daily",2.38,each,Bakery,Sara Lee,https://via.placeholder.com/60x60/F8F9FA/333?text=游
bak_058_5396,Brioche Bread,12722437635,face_058,"Fresh baked brioche bread, made daily",3.52,each,Bakery,Bakery Select,https://via.placeholder.com/60x60/F8F9FA/333?text=游
bak_058_1348,English Muffins,11732823359,face_058,"Fresh baked english muffins, made daily",2.24,each,Bakery,Pepperidge Farm,https://via.placeholder.com/60x60/F8F9FA/333?text=游븨
bak_058_8436,Naan Bread,09763721841,face_058,"Fresh baked naan bread, made daily",3.05,each,Bakery,Wonder Bread,https://via.placeholder.com/60x60/F8F9FA/333?text=游
bak_058_8015,Sourdough Bread,11504181784,face_058,"Fresh baked sourdough bread, made daily",2.07,each,Bakery,Bakery Select,https://via.placeholder.com/60x60/F8F9FA/333?text=游
bak_058_1636,Italian Bread,09797011538,face_058,"Fresh baked italian bread, made daily",4.0,each,Bakery,King's Hawaiian,https://via.placeholder.com/60x60/F8F9FA/333?text=游
bak_058_3888,Tortillas,15801881385,face_058,"Fresh baked tortillas, made daily",2.29,each,Bakery,La Brea,https://via.placeholder.com/60x60/F8F9FA/333?text=游
bak_058_5261,Dinner Rolls,12382775775,face_058,"Fresh baked dinner rolls, made daily",3.57,each,Bakery,King's Hawaiian,https://via.placeholder.com/60x60/F8F9FA/333?text=游
pan_059_2061,Mustard,35390278931,face_059,"High quality mustard, long shelf life",5.33,each,Pantry,Heinz,https://via.placeholder.com/60x60/F8F9FA/333?text=游
pan_059_7393,Worcestershire Sauce,32591991012,face_059,"High quality worcestershire sauce, long shelf life",2.9,each,Pantry,Hunt's,https://via.placeholder.com/60x60/F8F9FA/333?text=游
pan_059_5518,Honey,33252402960,face_059,"High quality honey, long shelf life",3.8,each,Pantry,Kraft,https://via.placeholder.com/60x60/F8F9FA/333?text=游
pan_059_4394,Jelly,31205988999,face_059,"High quality jelly, long shelf life",3.7,each,Pantry,Kraft,https://via.placeholder.com/60x60/F8F9FA/333?text=游
pan_059_7339,Maple Syrup,35588292066,face_059,"High quality maple syrup, long shelf life",3.2,each,Pantry,Bush's,https://via.placeholder.com/60x60/F8F9FA/333?text=游
pan_059_8744,Olive Oil,34551575729,face_059,"High quality olive oil, long shelf life",2.48,each,Pantry,Campbell's,https://via.placeholder.com/60x60/F8F9FA/333?text=游
pan_059_4535,Soy Sauce,32261427819,face_059,"High quality soy sauce, long shelf life",2.41,each,Pantry,Heinz,https://via.placeholder.com/60x60/F8F9FA/333?text=游
pan_059_1719,Vegetable Oil,31103889744,face_059,"High quality vegetable oil, long shelf life",2.23,each,Pantry,Del Monte,https://via.placeholder.com/60x60/F8F9FA/333?text=游
pan_059_7854,Jam,36251420696,face_059,"High quality jam, long shelf life",5.85,each,Pantry,Campbell's,https://via.placeholder.com/60x60/F8F9FA/333?text=游
pan_059_8803,Hot Sauce,35579894186,face_059,"High quality hot sauce, long shelf life",3.76,each,Pantry,Campbell's,https://via.placeholder.com/60x60/F8F9FA/333?text=游
pan_059_4276,Vinegar,33990020420,face_059,"High quality vinegar, long shelf life",5.97,each,Pantry,Great Value,https://via.placeholder.com/60x60/F8F9FA/333?text=游
pan_059_4364,Peanut Butter,38118249348,face_059,"High quality peanut butter, long shelf life",4.15,each,Pantry,Bush's,https://via.placeholder.com/60x60/F8F9FA/333?text=游븯
pan_059_6666,Ketchup,37528718171,face_059,"High quality ketchup, long shelf life",3.49,each,Pantry,Heinz,https://via.placeholder.com/60x60/F8F9FA/333?text=游
pan_059_9311,Mayonnaise,34824500293,face_059,"High quality mayonnaise, long shelf life",5.48,each,Pantry,Bush's,https://via.placeholder.com/60x60/F8F9FA/333?text=游
pro_060_2326,Cavendish Bananas,8442,face_060,"Fresh cavendish bananas, premium quality",4.86,lb,Produce,Earthbound Farm,https://via.placeholder.com/60x60/F8F9FA/333?text=游꼛
pro_060_6941,Dragon Fruit,6150,face_060,"Fresh dragon fruit, premium quality",3.77,lb,Produce,Organic Valley,https://via.placeholder.com/60x60/F8F9FA/333?text=游
pro_060_7207,Pineapple,8706,face_060,"Fresh pineapple, premium quality",4.21,lb,Produce,Fresh Harvest,https://via.placeholder.com/60x60/F8F9FA/333?text=游꼝
pro_060_2999,Bananas,4726,face_060,"Fresh bananas, premium quality",2.59,lb,Produce,Fresh Harvest,https://via.placeholder.com/60x60/F8F9FA/333?text=游꼛
pro_060_6878,Blueberries,8753,face_060,"Fresh blueberries, premium quality",3.93,lb,Produce,Chiquita,https://via.placeholder.com/60x60/F8F9FA/333?text=游
pro_060_4846,Valencia Oranges,5958,face_060,"Fresh valencia oranges, premium quality",4.72,lb,Produce,Del Monte,https://via.placeholder.com/60x60/F8F9FA/333?text=游꼙
pro_060_1060,Blackberries,4677,face_060,"Fresh blackberries, premium quality",4.52,lb,Produce,Organic Valley,https://via.placeholder.com/60x60/F8F9FA/333?text=游
pro_060_8591,Green Grapes,6980,face_060,"Fresh green grapes, premium quality",1.36,lb,Produce,Fresh Harvest,https://via.placeholder.com/60x60/F8F9FA/333?text=游꼖
pro_060_5883,Strawberries,9161,face_060,"Fresh strawberries, premium quality",1.13,lb,Produce,Earthbound Farm,https://via.placeholder.com/60x60/F8F9FA/333?text=游
pro_060_7685,Navel Oranges,9652,face_060,"Fresh navel oranges, premium quality",1.06,lb,Produce,Earthbound Farm,https://via.placeholder.com/60x60/F8F9FA/333?text=游꼙
pro_060_2371,Organic Bananas,8472,face_060,"Fresh organic bananas, premium quality",1.76,lb,Produce,Local Farm,https://via.placeholder.com/60x60/F8F9FA/333?text=游꼛
pro_060_2005,Raspberries,8746,face_060,"Fresh raspberries, premium quality",4.42,lb,Produce,Driscoll's,https://via.placeholder.com/60x60/F8F9FA/333?text=游
pro_060_4727,Black Grapes,5749,face_060,"Fresh black grapes, premium quality",4.28,lb,Produce,Fresh Harvest,https://via.placeholder.com/60x60/F8F9FA/333?text=游꼖
pro_060_8668,Fuji Apples,7710,face_060,"Fresh fuji apples, premium quality",2.57,lb,Produce,Chiquita,https://via.placeholder.com/60x60/F8F9FA/333?text=游꼝
pro_060_9746,Papaya,4478,face_060,"Fresh papaya, premium quality",3.14,lb,Produce,Del Monte,https://via.placeholder.com/60x60/F8F9FA/333?text=游
pro_060_5243,Plantains,8647,face_060,"Fresh plantains, premium quality",2.26,lb,Produce,Driscoll's,https://via.placeholder.com/60x60/F8F9FA/333?text=游
pro_060_7058,Granny Smith Apples,5502,face_060,"Fresh granny smith apples, premium quality",2.82,lb,Produce,Del Monte,https://via.placeholder.com/60x60/F8F9FA/333?text=游꼝
pro_060_3991,Gala Apples,8441,face_060,"Fresh gala apples, premium quality",1.0,lb,Produce,Earthbound Farm,https://via.placeholder.com/60x60/F8F9FA/333?text=游꼝
pro_060_8133,Cotton Candy Grapes,5575,face_060,"Fresh cotton candy grapes, premium quality",0.59,lb,Produce,Del Monte,https://via.placeholder.com/60x60/F8F9FA/333?text=游꼖
pro_060_8129,Blood Oranges,6701,face_060,"Fresh blood oranges, premium quality",1.06,lb,Produce,Del Monte,https://via.placeholder.com/60x60/F8F9FA/333?text=游꼙
pro_060_4624,Red Grapes,5869,face_060,"Fresh red grapes, premium quality",3.41,lb,Produce,Del Monte,https://via.placeholder.com/60x60/F8F9FA/333?text=游꼖
pro_060_5119,Red Delicious Apples,7969,face_060,"Fresh red delicious apples, premium quality",4.83,lb,Produce,Dole,https://via.placeholder.com/60x60/F8F9FA/333?text=游꼝
pro_060_2849,Kiwi,9791,face_060,"Fresh kiwi, premium quality",1.52,lb,Produce,Fresh Harvest,https://via.placeholder.com/60x60/F8F9FA/333?text=游
pro_060_4453,Clementines,8414,face_060,"Fresh clementines, premium quality",1.73,lb,Produce,Fresh Harvest,https://via.placeholder.com/60x60/F8F9FA/333?text=游
pro_060_4261,Mango,4888,face_060,"Fresh mango, premium quality",1.25,lb,Produce,Dole,https://via.placeholder.com/60x60/F8F9FA/333?text=游
dai_061_9276,String Cheese,04581403868,face_061,"Premium string cheese, great taste and quality",6.5,each,Dairy,Great Value,https://via.placeholder.com/60x60/F8F9FA/333?text=游
dai_061_1476,Mild Cheddar Cheese,03671708335,face_061,"Premium mild cheddar cheese, great taste and quality",8.0,each,Dairy,Fage,https://via.placeholder.com/60x60/F8F9FA/333?text=游
dai_061_1891,Cottage Cheese,10969906129,face_061,"Premium cottage cheese, great taste and quality",6.33,each,Dairy,Kraft,https://via.placeholder.com/60x60/F8F9FA/333?text=游
dai_061_9099,Brie Cheese,05797871084,face_061,"Premium brie cheese, great taste and quality",4.98,each,Dairy,Philadelphia,https://via.placeholder.com/60x60/F8F9FA/333?text=游
dai_061_2107,Blue Cheese,11416949723,face_061,"Premium blue cheese, great taste and quality",5.73,each,Dairy,Fage,https://via.placeholder.com/60x60/F8F9FA/333?text=游
dai_061_3063,White Cheddar Cheese,11412359391,face_061,"Premium white cheddar cheese, great taste and quality",7.21,each,Dairy,Great Value,https://via.placeholder.com/60x60/F8F9FA/333?text=游
dai_061_6396,Colby Jack Cheese,11265338610,face_061,"Premium colby jack cheese, great taste and quality",3.56,each,Dairy,Organic Valley,https://via.placeholder.com/60x60/F8F9FA/333?text=游
dai_061_9324,Sharp Cheddar Cheese,12804785003,face_061,"Premium sharp cheddar cheese, great taste and quality",4.86,each,Dairy,Chobani,https://via.placeholder.com/60x60/F8F9FA/333?text=游
dai_061_6166,Parmesan Cheese,10218435159,face_061,"Premium parmesan cheese, great taste and quality",3.21,each,Dairy,Daisy,https://via.placeholder.com/60x60/F8F9FA/333?text=游
dai_061_7288,Feta Cheese,08842640696,face_061,"Premium feta cheese, great taste and quality",5.3,each,Dairy,Great Value,https://via.placeholder.com/60x60/F8F9FA/333?text=游
dai_061_2698,Ricotta Cheese,11941911987,face_061,"Premium ricotta cheese, great taste and quality",8.85,each,Dairy,Chobani,https://via.placeholder.com/60x60/F8F9FA/333?text=游
dai_061_7286,Swiss Cheese,05883417922,face_061,"Premium swiss cheese, great taste and quality",3.47,each,Dairy,Philadelphia,https://via.placeholder.com/60x60/F8F9FA/333?text=游
dai_061_3010,Provolone Cheese,09475747352,face_061,"Premium provolone cheese, great taste and quality",6.52,each,Dairy,Land O'Lakes,https://via.placeholder.com/60x60/F8F9FA/333?text=游
dai_061_4871,Gouda Cheese,10293402506,face_061,"Premium gouda cheese, great taste and quality",7.1,each,Dairy,Chobani,https://via.placeholder.com/60x60/F8F9FA/333?text=游
dai_061_4577,Cream Cheese,07400697269,face_061,"Premium cream cheese, great taste and quality",6.15,each,Dairy,Organic Valley,https://via.placeholder.com/60x60/F8F9FA/333?text=游
dai_061_6745,Mozzarella Cheese,09726319918,face_061,"Premium mozzarella cheese, great taste and quality",3.78,each,Dairy,Organic Valley,https://via.placeholder.com/60x60/F8F9FA/333?text=游
mea_062_3050,Pork Shoulder,22285036365,face_062,"Fresh pork shoulder, USDA inspected",4.6,lb,Meat,Smithfield,https://via.placeholder.com/60x60/F8F9FA/333?text=游볩
mea_062_9997,Andouille Sausage,21566849530,face_062,"Fresh andouille sausage, USDA inspected",7.22,lb,Meat,Oscar Mayer,https://via.placeholder.com/60x60/F8F9FA/333?text=游
mea_062_1241,Pork Sausage,26738023295,face_062,"Fresh pork sausage, USDA inspected",12.67,lb,Meat,Smithfield,https://via.placeholder.com/60x60/F8F9FA/333?text=游볩
mea_062_2547,Ham,29372154606,face_062,"Fresh ham, USDA inspected",9.74,lb,Meat,Johnsonville,https://via.placeholder.com/60x60/F8F9FA/333?text=游
mea_062_3734,Bratwurst,23877074912,face_062,"Fresh bratwurst, USDA inspected",9.3,lb,Meat,Butterball,https://via.placeholder.com/60x60/F8F9FA/333?text=游
mea_062_5601,Bacon,27988820365,face_062,"Fresh bacon, USDA inspected",5.43,lb,Meat,Oscar Mayer,https://via.placeholder.com/60x60/F8F9FA/333?text=游
mea_062_3779,Pork Chops,29792058589,face_062,"Fresh pork chops, USDA inspected",6.65,lb,Meat,Hillshire Farm,https://via.placeholder.com/60x60/F8F9FA/333?text=游볩
mea_062_2535,Pork Belly,20988058695,face_062,"Fresh pork belly, USDA inspected",11.85,lb,Meat,Smithfield,https://via.placeholder.com/60x60/F8F9FA/333?text=游볩
mea_062_1050,Pork Loin,25943302462,face_062,"Fresh pork loin, USDA inspected",7.31,lb,Meat,Butterball,https://via.placeholder.com/60x60/F8F9FA/333?text=游볩
mea_062_3154,Kielbasa,29906897185,face_062,"Fresh kielbasa, USDA inspected",7.82,lb,Meat,Fresh Market,https://via.placeholder.com/60x60/F8F9FA/333?text=游
mea_062_6988,Pork Tenderloin,22592509180,face_062,"Fresh pork tenderloin, USDA inspected",7.73,lb,Meat,Perdue,https://via.placeholder.com/60x60/F8F9FA/333?text=游볩
mea_062_6363,Ground Pork,22303939591,face_062,"Fresh ground pork, USDA inspected",6.95,lb,Meat,Boar's Head,https://via.placeholder.com/60x60/F8F9FA/333?text=游볩
mea_062_5069,Italian Sausage,20299414436,face_062,"Fresh italian sausage, USDA inspected",10.03,lb,Meat,Boar's Head,https://via.placeholder.com/60x60/F8F9FA/333?text=游
bak_063_9769,Cakes,15991804379,face_063,"Fresh baked cakes, made daily",8.02,each,Bakery,Pepperidge Farm,https://via.placeholder.com/60x60/F8F9FA/333?text=游
bak_063_1017,Tiramisu,13690105659,face_063,"Fresh baked tiramisu, made daily",7.47,each,Bakery,Bakery Fresh,https://via.placeholder.com/60x60/F8F9FA/333?text=游
